,id,url,text,rating,time_created,user
0,HUCinO0feZ4WV0gXdM71cw,https://www.yelp.com/biz/huisache-grill-new-braunfels?adjust_creative=YbyBWgv3ab5QBB9Ji_-pqQ&hrid=HUCinO0feZ4WV0gXdM71cw&utm_campaign=yelp_api_v3&utm_medium=api_v3_business_reviews&utm_source=YbyBWgv3ab5QBB9Ji_-pqQ,"Such a cute little wine bar and restaurant! I came here for lunch on a Tuesday and was seated immediately. Great service, very fast. I ordered the trout...",5,2023-02-07 13:05:22,"{'id': 'HEtvS80TR3PjOUJP5JSRkQ', 'profile_url': 'https://www.yelp.com/user_details?userid=HEtvS80TR3PjOUJP5JSRkQ', 'image_url': 'https://s3-media3.fl.yelpcdn.com/photo/eaimKpJY8-CzKh-zkFSsiA/o.jpg', 'name': 'Vrithi C.'}"
1,vZhhUSomulgcwsKh5b2OvQ,https://www.yelp.com/biz/huisache-grill-new-braunfels?adjust_creative=YbyBWgv3ab5QBB9Ji_-pqQ&hrid=vZhhUSomulgcwsKh5b2OvQ&utm_campaign=yelp_api_v3&utm_medium=api_v3_business_reviews&utm_source=YbyBWgv3ab5QBB9Ji_-pqQ,"Visited this restaurant for the first time on Sunday & have heard nothing but great things.
We must have came at an odd time because the hostess had told us...",5,2023-01-12 21:37:16,"{'id': 'MaM1vJPWXrNIe2ZSqxvX4g', 'profile_url': 'https://www.yelp.com/user_details?userid=MaM1vJPWXrNIe2ZSqxvX4g', 'image_url': 'https://s3-media1.fl.yelpcdn.com/photo/6mY1Ods84ww-DpCT7xdRLw/o.jpg', 'name': 'Alexis G.'}"
2,g_Una5EzJ-oJS7bLa5lLtQ,https://www.yelp.com/biz/huisache-grill-new-braunfels?adjust_creative=YbyBWgv3ab5QBB9Ji_-pqQ&hrid=g_Una5EzJ-oJS7bLa5lLtQ&utm_campaign=yelp_api_v3&utm_medium=api_v3_business_reviews&utm_source=YbyBWgv3ab5QBB9Ji_-pqQ,"Really good food and always consistent in the kitchen. Their Duck on the Duck salad is always cooked to perfection. It's a definite must try. 
Their veggie...",5,2023-01-03 17:55:06,"{'id': '5oHzbcOeNr3SbwLp7VUyNg', 'profile_url': 'https://www.yelp.com/user_details?userid=5oHzbcOeNr3SbwLp7VUyNg', 'image_url': 'https://s3-media2.fl.yelpcdn.com/photo/MLefn4knVEtiXEoiuek6fQ/o.jpg', 'name': 'Katelyn K.'}"
